{
  "$schema": "https://json-schema.org/draft/2020-12/schema",
  "$id": "https://github.com/Beowxlf/northgate-vm-factory/schemas/control-plane-candidate.schema.json",
  "title": "NorthGate VM Factory disabled control-plane candidate",
  "type": "object",
  "additionalProperties": false,
  "required": [
    "$schema",
    "apiVersion",
    "kind",
    "candidateVersion",
    "status",
    "effectiveState",
    "interface",
    "promotion"
  ],
  "properties": {
    "$schema": { "const": "../../schemas/control-plane-candidate.schema.json" },
    "apiVersion": { "const": "northgate/v1alpha1" },
    "kind": { "const": "VmFactoryControlPlaneCandidate" },
    "candidateVersion": { "type": "string", "pattern": "^0\\.[0-9]+\\.[0-9]+$" },
    "status": { "const": "proposed" },
    "effectiveState": {
      "type": "object",
      "additionalProperties": false,
      "required": [
        "deployed",
        "applicationAuthenticationConfigured",
        "planRegistrationEnabled",
        "applyEnabled",
        "executableActions",
        "writerLockConfigured",
        "receiptSigningConfigured",
        "directMutationMethodsExposed"
      ],
      "properties": {
        "deployed": { "const": false },
        "applicationAuthenticationConfigured": { "const": false },
        "planRegistrationEnabled": { "const": false },
        "applyEnabled": { "const": false },
        "executableActions": { "type": "array", "maxItems": 0 },
        "writerLockConfigured": { "const": false },
        "receiptSigningConfigured": { "const": false },
        "directMutationMethodsExposed": { "const": false }
      }
    },
    "interface": {
      "type": "object",
      "additionalProperties": false,
      "required": [
        "stateOperation",
        "registerOperation",
        "getPlanOperation",
        "applyOperation",
        "applyInputFields"
      ],
      "properties": {
        "stateOperation": { "const": "vm_factory_get_state" },
        "registerOperation": { "const": "vm_factory_register_plan" },
        "getPlanOperation": { "const": "vm_factory_get_plan" },
        "applyOperation": { "const": "vm_factory_apply_plan" },
        "applyInputFields": {
          "type": "array",
          "const": ["planId"]
        }
      }
    },
    "promotion": {
      "type": "object",
      "additionalProperties": false,
      "required": [
        "repositorySourceMayExecuteOnHost",
        "installedSignedReleaseRequired",
        "separateReviewedChangeRequired",
        "requiredGates"
      ],
      "properties": {
        "repositorySourceMayExecuteOnHost": { "const": false },
        "installedSignedReleaseRequired": { "const": true },
        "separateReviewedChangeRequired": { "const": true },
        "requiredGates": {
          "type": "array",
          "const": [
            "restrictive-acls-proven",
            "immutable-signed-release-promoted",
            "forwarding-only-identity-proven",
            "application-authentication-proven",
            "data-only-fetcher-proven",
            "protected-branch-reachability-proven",
            "strict-plan-validation-proven",
            "identity-ledger-proven",
            "host-writer-lock-proven",
            "audit-fail-closed-proven",
            "receipt-signing-proven",
            "rollback-tested",
            "direct-mutators-disabled"
          ]
        }
      }
    }
  }
}
